{
  "$schema": "https://json-schema.org/draft/2020-12/schema",
  "$id": "https://schemas.indigen-world.org/v0/published-content.schema.json",
  "title": "PublishedContent",
  "description": "The stable, mobile-app-facing contract for approved content. Created only by the trusted publication workflow from an APPROVED submission. Never contains raw submission media paths, private contact data, internal reviews, notes or payout data.",
  "type": "object",
  "properties": {
    "id": { "$ref": "common.schema.json#/$defs/identifier" },
    "submission": { "$ref": "common.schema.json#/$defs/reference" },
    "campaign": { "oneOf": [{ "$ref": "common.schema.json#/$defs/reference" }, { "type": "null" }] },
    "creatorAttribution": {
      "type": "object",
      "description": "Public attribution only — display name and optional avatar, never contact details.",
      "properties": {
        "creatorId": { "$ref": "common.schema.json#/$defs/identifier" },
        "displayName": { "type": "string", "minLength": 1 },
        "avatarUrl": { "oneOf": [{ "type": "string", "format": "uri" }, { "type": "null" }] }
      },
      "required": ["creatorId", "displayName"],
      "additionalProperties": false
    },
    "language": { "$ref": "common.schema.json#/$defs/languageCode" },
    "dialect": { "type": "string" },
    "category": { "type": "string" },
    "collectionKind": {
      "oneOf": [{ "$ref": "common.schema.json#/$defs/collectionKind" }, { "type": "null" }]
    },
    "corpusArea": { "type": "string", "enum": ["lexicon", "grammar", "expressions", "sentences", "proverbs", "literature", "dialogue", "pronunciation", "culture", "qa"] },
    "authenticationStatus": { "type": "string", "enum": ["community", "reviewed", "gold", "rejected", "unspecified"] },
    "title": { "type": "string", "minLength": 1 },
    "description": { "type": "string" },
    "body": {
      "type": "string",
      "description": "Approved long-form text. Kept separately so literature is never reduced to a short summary."
    },
    "englishSummary": { "type": "string" },
    "lexicalKind": {
      "description": "For dictionary work, what kind of lexical item this is. A word can be prompted for from a queue; a proverb is something somebody's grandmother said and cannot be. Null on every other kind of published work.",
      "oneOf": [
        { "type": "string", "enum": ["word", "phrase", "idiom", "proverb"] },
        { "type": "null" }
      ]
    },
    "translations": {
      "type": "array",
      "items": { "type": "string" },
      "description": "Every Kasem rendering the contributor gave for this entry, in the order they gave them. A Kasem word rarely maps to exactly one English word, so a single value would force a choice the contributor did not make. Empty on work that is not a dictionary entry.",
      "maxItems": 8
    },
    "mediaUrl": { "type": "string", "description": "Signed or CDN delivery reference for approved media." },
    "mediaType": { "oneOf": [{ "$ref": "common.schema.json#/$defs/mediaType" }, { "type": "null" }] },
    "thumbnailUrl": { "oneOf": [{ "type": "string" }, { "type": "null" }] },
    "captionsUrl": { "oneOf": [{ "type": "string" }, { "type": "null" }] },
    "culturalNotes": { "type": "string" },
    "ageRating": { "type": "string", "enum": ["all", "7+", "13+", "16+", "18+"] },
    "tags": { "type": "array", "items": { "type": "string" } },
    "publicationStatus": { "$ref": "common.schema.json#/$defs/publicationStatus" },
    "publishedAt": { "oneOf": [{ "$ref": "common.schema.json#/$defs/isoTimestamp" }, { "type": "null" }] },
    "licenceDisplay": { "type": "string", "description": "Human-readable rights/licence line for display." },
    "sourceAttribution": { "type": "string", "description": "Public source or authorship line supplied with the approved work." },
    "publicationRoute": {
      "type": "string",
      "enum": ["open", "reviewed", "collection_review", "admin"]
    },
    "correctionState": {
      "type": "string",
      "enum": ["none", "corrected", "takedown_requested", "removed"]
    },
    "schemaVersion": { "type": "integer", "minimum": 1 },
    "lifecycle": { "$ref": "common.schema.json#/$defs/recordLifecycle" }
  },
  "required": ["id", "submission", "campaign", "creatorAttribution", "title", "publicationStatus", "lifecycle"],
  "additionalProperties": false
}
