{
  "id": "pub-ama-1",
  "submission": { "collection": "submissions", "id": "sub-ama-1" },
  "campaign": { "collection": "campaigns", "id": "kasem-creator-challenge" },
  "creatorAttribution": {
    "creatorId": "creator-ama",
    "displayName": "Ama the Storyteller",
    "avatarUrl": null
  },
  "language": "xsm",
  "dialect": "navrongo",
  "category": "storytelling",
  "collectionKind": "literature",
  "title": "The Clever Hare",
  "description": "A retelling of a classic Kasem folktale.",
  "body": "A long-form Kasem and English retelling of the clever hare story.",
  "englishSummary": "A hare outwits a lion using cleverness.",
  "mediaUrl": "https://cdn.example.com/pub-ama-1.mp4",
  "mediaType": "video",
  "thumbnailUrl": null,
  "captionsUrl": null,
  "culturalNotes": "Told to children to teach wit over strength.",
  "ageRating": "all",
  "tags": ["folktale", "kasena"],
  "publicationStatus": "published",
  "publishedAt": "2026-08-20T00:00:00Z",
  "licenceDisplay": "© Ama the Storyteller · Published with permission by Indigen World",
  "sourceAttribution": "Ama the Storyteller",
  "publicationRoute": "reviewed",
  "correctionState": "none",
  "schemaVersion": 1,
  "lifecycle": {
    "createdAt": "2026-08-20T00:00:00Z",
    "updatedAt": "2026-08-20T00:00:00Z",
    "version": 1
  }
}
